{
    "format_version": "1.0.0",
    "repository": "tpde2/tpde",
    "tpde_commit": "338d41890e424b058e2053b6a5787e1348e3dd57",
    "primary_target": "linux-elf-x86-64",
    "secondary_target": "aarch64-analyzed-unreleased",
    "classifications": [
        "blocked",
        "covered",
        "not_needed",
        "php_shim",
        "tpde_core_patch",
        "tpde_extension"
    ],
    "reviewed_source_files": [
        "CMakeLists.txt",
        "README.md",
        "docs/tpde/adaptor.md",
        "docs/tpde/compiler-ref.md",
        "docs/tpde/overview.md",
        "tpde/CMakeLists.txt",
        "tpde/include/tpde/AssemblerElf.hpp",
        "tpde/include/tpde/AssignmentPartRef.hpp",
        "tpde/include/tpde/Compiler.hpp",
        "tpde/include/tpde/CompilerBase.hpp",
        "tpde/include/tpde/ElfMapper.hpp",
        "tpde/include/tpde/FunctionWriter.hpp",
        "tpde/include/tpde/IRAdaptor.hpp",
        "tpde/include/tpde/ValueAssignment.hpp",
        "tpde/include/tpde/arm64/CompilerA64.hpp",
        "tpde/include/tpde/x64/CompilerX64.hpp",
        "tpde/src/ElfMapper.cpp"
    ],
    "capabilities": [
        {
            "id": "ir-adaptor-ssa-phi",
            "critical": true,
            "php_requirement": "Lower the frozen PHP native IR through an SSA-aware adaptor with explicit blocks, operands, results, and PHI inputs.",
            "motivating_contract": "ADR 0003 requires an explicit native IR whose control and data dependencies remain reviewable.",
            "classification": "covered",
            "source_refs": [{"path": "tpde/include/tpde/IRAdaptor.hpp", "symbol": "concept IRAdaptor", "start_line": 79, "end_line": 105, "evidence": "The adaptor is an IR-independent function, block, instruction, and value interface."}, {"path": "tpde/include/tpde/IRAdaptor.hpp", "symbol": "concept PHIRef", "start_line": 54, "end_line": 77, "evidence": "PHI inputs expose incoming values and blocks."}],
            "existing_behavior": "IRAdaptor and PHIRef provide the required SSA-shaped boundary.",
            "missing_behavior": "None.",
            "minimal_api_or_shim": "None.",
            "owner": "tpde",
            "upstreamability": "not_applicable",
            "target_impact": {"x86_64": {"status": "required", "impact": "Architecture-independent adaptor used by the primary backend."}, "aarch64": {"status": "analyzed_unreleased", "impact": "The same adaptor boundary applies to the follow-on backend."}},
            "required_tests": ["Compile CFGs with loop and merge PHIs through the PHP adaptor."]
        },
        {
            "id": "single-entry-functions",
            "critical": true,
            "php_requirement": "Give every generated unit one explicit entry and model resume points without jumping into a compiled function body.",
            "motivating_contract": "W01-C requires deterministic frame reconstruction and explicit resume targets.",
            "classification": "covered",
            "source_refs": [{"path": "tpde/include/tpde/IRAdaptor.hpp", "symbol": "cur_entry_block", "start_line": 217, "end_line": 225, "evidence": "Each current function has one entry block and that block is first."}],
            "existing_behavior": "A TPDE function has one cur_entry_block; a module may contain multiple functions.",
            "missing_behavior": "None.",
            "minimal_api_or_shim": "None.",
            "owner": "shared",
            "upstreamability": "not_applicable",
            "target_impact": {"x86_64": {"status": "required", "impact": "Resume code must respect single entry."}, "aarch64": {"status": "analyzed_unreleased", "impact": "The architecture-independent restriction is identical."}},
            "required_tests": ["Reject a PHP lowering that names a mid-function native entry."]
        },
        {
            "id": "multipart-values",
            "critical": true,
            "php_requirement": "Represent values split across multiple machine parts and register banks.",
            "motivating_contract": "PHP frame and helper interfaces can require compound values and ABI aggregates.",
            "classification": "covered",
            "source_refs": [{"path": "tpde/include/tpde/Compiler.hpp", "symbol": "concept ValueParts", "start_line": 27, "end_line": 37, "evidence": "ValueParts exposes count, byte size, and register bank per part."}],
            "existing_behavior": "TPDE natively describes and assigns multipart values.",
            "missing_behavior": "None.",
            "minimal_api_or_shim": "None.",
            "owner": "tpde",
            "upstreamability": "not_applicable",
            "target_impact": {"x86_64": {"status": "required", "impact": "Part assignment follows x86-64 banks."}, "aarch64": {"status": "analyzed_unreleased", "impact": "Part assignment must be tested against AArch64 banks and ABI."}},
            "required_tests": ["Exercise values with two parts across integer and floating-point banks."]
        },
        {
            "id": "calls-calling-conventions",
            "critical": true,
            "php_requirement": "Emit helper and generated-function calls with explicit argument, result, vararg, and stack assignments.",
            "motivating_contract": "ADR 0005 confines runtime interaction to reviewed helper boundaries.",
            "classification": "covered",
            "source_refs": [{"path": "tpde/include/tpde/CompilerBase.hpp", "symbol": "class CCAssigner", "start_line": 77, "end_line": 94, "evidence": "CCAssigner assigns arguments and returns and exposes vararg behavior."}],
            "existing_behavior": "TPDE provides calling-convention assignment and target call builders.",
            "missing_behavior": "None.",
            "minimal_api_or_shim": "None.",
            "owner": "shared",
            "upstreamability": "not_applicable",
            "target_impact": {"x86_64": {"status": "required", "impact": "PHP helper ABI must bind to the x86-64 assigner."}, "aarch64": {"status": "analyzed_unreleased", "impact": "The AArch64 helper ABI needs separate conformance tests."}},
            "required_tests": ["Check integer, floating, stack, return, and vararg helper-call assignments."]
        },
        {
            "id": "fixed-context-registers",
            "critical": true,
            "php_requirement": "Keep selected PHP execution context values in fixed registers where the target ABI permits it.",
            "motivating_contract": "ADR 0004 reserves context registers but requires ordinary frame state to remain authoritative at boundaries.",
            "classification": "covered",
            "source_refs": [{"path": "tpde/include/tpde/Compiler.hpp", "symbol": "try_force_fixed_assignment", "start_line": 75, "end_line": 103, "evidence": "The compiler contract selects and may force fixed assignments."}],
            "existing_behavior": "Derived compilers can force an IR value into a target-selected fixed assignment.",
            "missing_behavior": "None.",
            "minimal_api_or_shim": "None.",
            "owner": "shared",
            "upstreamability": "not_applicable",
            "target_impact": {"x86_64": {"status": "required", "impact": "Register selection must avoid target-reserved and EH-sensitive registers."}, "aarch64": {"status": "analyzed_unreleased", "impact": "AArch64 has a distinct non-allocatable mask and callee-saved constraints."}},
            "required_tests": ["Verify fixed assignments survive calls and remain excluded from general allocation."]
        },
        {
            "id": "branches-switches",
            "critical": true,
            "php_requirement": "Lower unconditional, conditional, and multi-way PHP control flow.",
            "motivating_contract": "The frozen native IR includes explicit CFG edges and switch-like opcode control flow.",
            "classification": "covered",
            "source_refs": [{"path": "tpde/include/tpde/CompilerBase.hpp", "symbol": "generate_switch", "start_line": 473, "end_line": 495, "evidence": "CompilerBase exposes unconditional, conditional, and switch generation."}],
            "existing_behavior": "Architecture-independent branch helpers cover the required forms.",
            "missing_behavior": "None.",
            "minimal_api_or_shim": "None.",
            "owner": "tpde",
            "upstreamability": "not_applicable",
            "target_impact": {"x86_64": {"status": "required", "impact": "Primary backend branch encodings are required."}, "aarch64": {"status": "analyzed_unreleased", "impact": "AArch64 branch reach and jump-table encodings require target tests."}},
            "required_tests": ["Compile dense and sparse switches plus forward and backward branches."]
        },
        {
            "id": "symbols-relocations",
            "critical": true,
            "php_requirement": "Name generated and external entities and attach target relocations to sections.",
            "motivating_contract": "Native images must resolve helpers and generated functions without embedding unstable process addresses.",
            "classification": "covered",
            "source_refs": [{"path": "tpde/include/tpde/AssemblerElf.hpp", "symbol": "sym_add_undef", "start_line": 85, "end_line": 107, "evidence": "ELF symbols can represent undefined functions and data."}, {"path": "tpde/include/tpde/CompilerBase.hpp", "symbol": "reloc_text", "start_line": 570, "end_line": 584, "evidence": "The compiler attaches relocations to the text section."}],
            "existing_behavior": "AssemblerElf and CompilerBase can create symbols and in-memory relocation records.",
            "missing_behavior": "None.",
            "minimal_api_or_shim": "None.",
            "owner": "tpde",
            "upstreamability": "not_applicable",